{
  "schema_version": "1",
  "id": "view-critical-findings",
  "org": "padosoft",
  "project": "demo",
  "surface": "findings",
  "name": "Critical findings",
  "owner": "user-alice",
  "shared": true,
  "created_at": "2026-05-18T08:00:00.000Z",
  "updated_at": "2026-05-18T08:30:00.000Z",
  "state": { "severity": "critical", "status": "open" }
}
